<?xml version="1.0" encoding="utf-8"?>
<!DOCTYPE Builds[
<!ELEMENT Builds (Build+)>
<!ELEMENT Build (BodyId, LensId, FilterId, Price, Year)>
<!ATTLIST Build Id ID #REQUIRED>
<!ELEMENT BodyId (#PCDATA) >
<!ELEMENT LensId (#PCDATA) >
<!ELEMENT FilterId (#PCDATA) >
<!ELEMENT Price (#PCDATA) >
<!ELEMENT Year (#PCDATA) >
]>
<?xml-stylesheet type="text/xsl" href="style.xsl"?>
<Builds>
  <Build Id="1">
    <BodyId>154</BodyId>
    <LensId>43</LensId>
    <FilterId>230</FilterId>
    <Price>613</Price>
    <!--Top in da world comment-->
    <Year>2009-10-09</Year>
  </Build>
  <Build Id="2">
    <BodyId>238</BodyId>
    <LensId>313</LensId>
    <FilterId>244</FilterId>
    <Price>554</Price>
    <Year>2017-06-05</Year>
  </Build>
  <Build Id="3">
    <BodyId>376</BodyId>
    <LensId>370</LensId>
    <FilterId>99</FilterId>
    <Price>892</Price>
    <Year>2017-09-30</Year>
  </Build>
  <Build Id="4">
    <BodyId>798</BodyId>
    <LensId>507</LensId>
    <FilterId>24</FilterId>
    <Price>441</Price>
    <Year>2015-10-08</Year>
  </Build>
  <Build Id="5">
    <BodyId>304</BodyId>
    <LensId>151</LensId>
    <FilterId>441</FilterId>
    <Price>941</Price>
    <Year>2009-06-30</Year>
  </Build>
  <Build Id="6">
    <BodyId>205</BodyId>
    <LensId>592</LensId>
    <FilterId>986</FilterId>
    <Price>728</Price>
    <Year>2008-05-18</Year>
  </Build>
  <Build Id="7">
    <BodyId>191</BodyId>
    <LensId>289</LensId>
    <FilterId>500</FilterId>
    <Price>1200</Price>
    <Year>2009-06-10</Year>
  </Build>
  <Build Id="8">
    <BodyId>953</BodyId>
    <LensId>786</LensId>
    <FilterId>752</FilterId>
    <Price>822</Price>
    <Year>2011-08-15</Year>
  </Build>
  <Build Id="9">
    <BodyId>146</BodyId>
    <LensId>617</LensId>
    <FilterId>953</FilterId>
    <Price>1172</Price>
    <Year>2008-05-05</Year>
  </Build>
  <Build Id="10">
    <BodyId>451</BodyId>
    <LensId>607</LensId>
    <FilterId>202</FilterId>
    <Price>666</Price>
    <Year>2014-01-05</Year>
  </Build>
  <Build Id="11">
    <BodyId>942</BodyId>
    <LensId>440</LensId>
    <FilterId>884</FilterId>
    <Price>1142</Price>
    <Year>2015-12-29</Year>
  </Build>
  <Build Id="12">
    <BodyId>245</BodyId>
    <LensId>775</LensId>
    <FilterId>320</FilterId>
    <Price>1335</Price>
    <Year>2013-05-02</Year>
  </Build>
  <Build Id="13">
    <BodyId>202</BodyId>
    <LensId>832</LensId>
    <FilterId>938</FilterId>
    <Price>445</Price>
    <Year>2013-09-09</Year>
  </Build>
  <Build Id="14">
    <BodyId>569</BodyId>
    <LensId>316</LensId>
    <FilterId>911</FilterId>
    <Price>648</Price>
    <Year>2011-08-04</Year>
  </Build>
  <Build Id="15">
    <BodyId>950</BodyId>
    <LensId>273</LensId>
    <FilterId>428</FilterId>
    <Price>1007</Price>
    <Year>2011-11-30</Year>
  </Build>
  <Build Id="16">
    <BodyId>21</BodyId>
    <LensId>885</LensId>
    <FilterId>948</FilterId>
    <Price>479</Price>
    <Year>2016-09-16</Year>
  </Build>
  <Build Id="17">
    <BodyId>737</BodyId>
    <LensId>655</LensId>
    <FilterId>875</FilterId>
    <Price>593</Price>
    <Year>2012-05-13</Year>
  </Build>
  <Build Id="18">
    <BodyId>765</BodyId>
    <LensId>435</LensId>
    <FilterId>875</FilterId>
    <Price>1161</Price>
    <Year>2014-01-04</Year>
  </Build>
  <Build Id="19">
    <BodyId>388</BodyId>
    <LensId>523</LensId>
    <FilterId>694</FilterId>
    <Price>1175</Price>
    <Year>2012-07-29</Year>
  </Build>
  <Build Id="20">
    <BodyId>472</BodyId>
    <LensId>641</LensId>
    <FilterId>545</FilterId>
    <Price>952</Price>
    <Year>2015-04-29</Year>
  </Build>
  <Build Id="21">
    <BodyId>738</BodyId>
    <LensId>567</LensId>
    <FilterId>76</FilterId>
    <Price>582</Price>
    <Year>2016-01-05</Year>
  </Build>
  <Build Id="22">
    <BodyId>497</BodyId>
    <LensId>380</LensId>
    <FilterId>46</FilterId>
    <Price>605</Price>
    <Year>2012-01-05</Year>
  </Build>
  <Build Id="23">
    <BodyId>165</BodyId>
    <LensId>673</LensId>
    <FilterId>147</FilterId>
    <Price>724</Price>
    <Year>2011-08-23</Year>
  </Build>
  <Build Id="24">
    <BodyId>296</BodyId>
    <LensId>97</LensId>
    <FilterId>253</FilterId>
    <Price>1231</Price>
    <Year>2013-03-12</Year>
  </Build>
  <Build Id="25">
    <BodyId>954</BodyId>
    <LensId>48</LensId>
    <FilterId>98</FilterId>
    <Price>528</Price>
    <Year>2015-03-08</Year>
  </Build>
  <Build Id="26">
    <BodyId>386</BodyId>
    <LensId>793</LensId>
    <FilterId>773</FilterId>
    <Price>1223</Price>
    <Year>2014-03-20</Year>
  </Build>
  <Build Id="27">
    <BodyId>775</BodyId>
    <LensId>70</LensId>
    <FilterId>486</FilterId>
    <Price>575</Price>
    <Year>2011-10-16</Year>
  </Build>
  <Build Id="28">
    <BodyId>868</BodyId>
    <LensId>236</LensId>
    <FilterId>321</FilterId>
    <Price>1039</Price>
    <Year>2018-04-04</Year>
  </Build>
  <Build Id="29">
    <BodyId>836</BodyId>
    <LensId>570</LensId>
    <FilterId>310</FilterId>
    <Price>651</Price>
    <Year>2009-05-19</Year>
  </Build>
  <Build Id="30">
    <BodyId>91</BodyId>
    <LensId>241</LensId>
    <FilterId>629</FilterId>
    <Price>515</Price>
    <Year>2013-03-30</Year>
  </Build>
  <Build Id="31">
    <BodyId>138</BodyId>
    <LensId>995</LensId>
    <FilterId>615</FilterId>
    <Price>802</Price>
    <Year>2012-12-24</Year>
  </Build>
  <Build Id="32">
    <BodyId>385</BodyId>
    <LensId>856</LensId>
    <FilterId>558</FilterId>
    <Price>371</Price>
    <Year>2010-10-06</Year>
  </Build>
  <Build Id="33">
    <BodyId>127</BodyId>
    <LensId>978</LensId>
    <FilterId>750</FilterId>
    <Price>533</Price>
    <Year>2013-04-30</Year>
  </Build>
  <Build Id="34">
    <BodyId>486</BodyId>
    <LensId>755</LensId>
    <FilterId>452</FilterId>
    <Price>891</Price>
    <Year>2016-01-05</Year>
  </Build>
  <Build Id="35">
    <BodyId>997</BodyId>
    <LensId>840</LensId>
    <FilterId>435</FilterId>
    <Price>941</Price>
    <Year>2013-01-24</Year>
  </Build>
  <Build Id="36">
    <BodyId>638</BodyId>
    <LensId>173</LensId>
    <FilterId>613</FilterId>
    <Price>859</Price>
    <Year>2012-11-08</Year>
  </Build>
  <Build Id="37">
    <BodyId>827</BodyId>
    <LensId>909</LensId>
    <FilterId>331</FilterId>
    <Price>1114</Price>
    <Year>2012-11-19</Year>
  </Build>
  <Build Id="38">
    <BodyId>873</BodyId>
    <LensId>878</LensId>
    <FilterId>414</FilterId>
    <Price>1095</Price>
    <Year>2013-11-06</Year>
  </Build>
  <Build Id="39">
    <BodyId>65</BodyId>
    <LensId>240</LensId>
    <FilterId>536</FilterId>
    <Price>1186</Price>
    <Year>2015-08-14</Year>
  </Build>
  <Build Id="40">
    <BodyId>767</BodyId>
    <LensId>389</LensId>
    <FilterId>763</FilterId>
    <Price>499</Price>
    <Year>2017-03-26</Year>
  </Build>
  <Build Id="41">
    <BodyId>865</BodyId>
    <LensId>822</LensId>
    <FilterId>17</FilterId>
    <Price>567</Price>
    <Year>2013-04-24</Year>
  </Build>
  <Build Id="42">
    <BodyId>931</BodyId>
    <LensId>643</LensId>
    <FilterId>442</FilterId>
    <Price>922</Price>
    <Year>2012-06-10</Year>
  </Build>
  <Build Id="43">
    <BodyId>706</BodyId>
    <LensId>934</LensId>
    <FilterId>339</FilterId>
    <Price>840</Price>
    <Year>2011-08-20</Year>
  </Build>
  <Build Id="44">
    <BodyId>895</BodyId>
    <LensId>857</LensId>
    <FilterId>510</FilterId>
    <Price>603</Price>
    <Year>2014-06-22</Year>
  </Build>
  <Build Id="45">
    <BodyId>285</BodyId>
    <LensId>760</LensId>
    <FilterId>240</FilterId>
    <Price>467</Price>
    <Year>2009-06-02</Year>
  </Build>
  <Build Id="46">
    <BodyId>199</BodyId>
    <LensId>956</LensId>
    <FilterId>703</FilterId>
    <Price>364</Price>
    <Year>2011-06-26</Year>
  </Build>
  <Build Id="47">
    <BodyId>630</BodyId>
    <LensId>126</LensId>
    <FilterId>356</FilterId>
    <Price>1380</Price>
    <Year>2016-10-25</Year>
  </Build>
  <Build Id="48">
    <BodyId>39</BodyId>
    <LensId>93</LensId>
    <FilterId>846</FilterId>
    <Price>1309</Price>
    <Year>2012-08-17</Year>
  </Build>
  <Build Id="49">
    <BodyId>841</BodyId>
    <LensId>957</LensId>
    <FilterId>482</FilterId>
    <Price>1317</Price>
    <Year>2015-02-13</Year>
  </Build>
  <Build Id="50">
    <BodyId>24</BodyId>
    <LensId>201</LensId>
    <FilterId>990</FilterId>
    <Price>1092</Price>
    <Year>2017-06-14</Year>
  </Build>
  <Build Id="51">
    <BodyId>994</BodyId>
    <LensId>0</LensId>
    <FilterId>689</FilterId>
    <Price>407</Price>
    <Year>2015-07-16</Year>
  </Build>
  <Build Id="52">
    <BodyId>198</BodyId>
    <LensId>714</LensId>
    <FilterId>100</FilterId>
    <Price>1306</Price>
    <Year>2013-09-06</Year>
  </Build>
  <Build Id="53">
    <BodyId>194</BodyId>
    <LensId>502</LensId>
    <FilterId>890</FilterId>
    <Price>646</Price>
    <Year>2016-06-22</Year>
  </Build>
  <Build Id="54">
    <BodyId>425</BodyId>
    <LensId>435</LensId>
    <FilterId>552</FilterId>
    <Price>472</Price>
    <Year>2011-10-15</Year>
  </Build>
  <Build Id="55">
    <BodyId>167</BodyId>
    <LensId>843</LensId>
    <FilterId>796</FilterId>
    <Price>1088</Price>
    <Year>2012-01-19</Year>
  </Build>
  <Build Id="56">
    <BodyId>133</BodyId>
    <LensId>83</LensId>
    <FilterId>441</FilterId>
    <Price>1006</Price>
    <Year>2010-08-27</Year>
  </Build>
  <Build Id="57">
    <BodyId>579</BodyId>
    <LensId>700</LensId>
    <FilterId>696</FilterId>
    <Price>763</Price>
    <Year>2014-12-04</Year>
  </Build>
  <Build Id="58">
    <BodyId>715</BodyId>
    <LensId>858</LensId>
    <FilterId>225</FilterId>
    <Price>738</Price>
    <Year>2017-01-11</Year>
  </Build>
  <Build Id="59">
    <BodyId>184</BodyId>
    <LensId>516</LensId>
    <FilterId>845</FilterId>
    <Price>609</Price>
    <Year>2010-09-08</Year>
  </Build>
  <Build Id="60">
    <BodyId>924</BodyId>
    <LensId>481</LensId>
    <FilterId>127</FilterId>
    <Price>637</Price>
    <Year>2009-01-30</Year>
  </Build>
  <Build Id="61">
    <BodyId>389</BodyId>
    <LensId>501</LensId>
    <FilterId>374</FilterId>
    <Price>522</Price>
    <Year>2010-04-13</Year>
  </Build>
  <Build Id="62">
    <BodyId>962</BodyId>
    <LensId>716</LensId>
    <FilterId>472</FilterId>
    <Price>893</Price>
    <Year>2017-12-24</Year>
  </Build>
  <Build Id="63">
    <BodyId>234</BodyId>
    <LensId>165</LensId>
    <FilterId>863</FilterId>
    <Price>865</Price>
    <Year>2012-06-27</Year>
  </Build>
  <Build Id="64">
    <BodyId>246</BodyId>
    <LensId>444</LensId>
    <FilterId>172</FilterId>
    <Price>460</Price>
    <Year>2014-04-29</Year>
  </Build>
  <Build Id="65">
    <BodyId>535</BodyId>
    <LensId>343</LensId>
    <FilterId>591</FilterId>
    <Price>1354</Price>
    <Year>2015-10-13</Year>
  </Build>
  <Build Id="66">
    <BodyId>267</BodyId>
    <LensId>968</LensId>
    <FilterId>157</FilterId>
    <Price>1016</Price>
    <Year>2017-09-02</Year>
  </Build>
  <Build Id="67">
    <BodyId>246</BodyId>
    <LensId>769</LensId>
    <FilterId>311</FilterId>
    <Price>812</Price>
    <Year>2010-01-08</Year>
  </Build>
  <Build Id="68">
    <BodyId>901</BodyId>
    <LensId>502</LensId>
    <FilterId>374</FilterId>
    <Price>1314</Price>
    <Year>2014-09-15</Year>
  </Build>
  <Build Id="69">
    <BodyId>898</BodyId>
    <LensId>775</LensId>
    <FilterId>760</FilterId>
    <Price>588</Price>
    <Year>2009-04-16</Year>
  </Build>
  <Build Id="70">
    <BodyId>343</BodyId>
    <LensId>778</LensId>
    <FilterId>10</FilterId>
    <Price>1197</Price>
    <Year>2011-12-12</Year>
  </Build>
  <Build Id="71">
    <BodyId>539</BodyId>
    <LensId>304</LensId>
    <FilterId>118</FilterId>
    <Price>661</Price>
    <Year>2017-01-20</Year>
  </Build>
  <Build Id="72">
    <BodyId>890</BodyId>
    <LensId>635</LensId>
    <FilterId>626</FilterId>
    <Price>1290</Price>
    <Year>2016-11-29</Year>
  </Build>
  <Build Id="73">
    <BodyId>901</BodyId>
    <LensId>486</LensId>
    <FilterId>952</FilterId>
    <Price>739</Price>
    <Year>2009-05-22</Year>
  </Build>
  <Build Id="74">
    <BodyId>238</BodyId>
    <LensId>520</LensId>
    <FilterId>706</FilterId>
    <Price>901</Price>
    <Year>2016-12-29</Year>
  </Build>
  <Build Id="75">
    <BodyId>302</BodyId>
    <LensId>662</LensId>
    <FilterId>256</FilterId>
    <Price>442</Price>
    <Year>2010-07-17</Year>
  </Build>
  <Build Id="76">
    <BodyId>31</BodyId>
    <LensId>266</LensId>
    <FilterId>642</FilterId>
    <Price>885</Price>
    <Year>2013-07-30</Year>
  </Build>
  <Build Id="77">
    <BodyId>723</BodyId>
    <LensId>376</LensId>
    <FilterId>973</FilterId>
    <Price>1397</Price>
    <Year>2009-12-19</Year>
  </Build>
  <Build Id="78">
    <BodyId>811</BodyId>
    <LensId>150</LensId>
    <FilterId>265</FilterId>
    <Price>1007</Price>
    <Year>2009-04-24</Year>
  </Build>
  <Build Id="79">
    <BodyId>961</BodyId>
    <LensId>325</LensId>
    <FilterId>573</FilterId>
    <Price>1094</Price>
    <Year>2015-12-05</Year>
  </Build>
  <Build Id="80">
    <BodyId>259</BodyId>
    <LensId>735</LensId>
    <FilterId>97</FilterId>
    <Price>990</Price>
    <Year>2012-07-18</Year>
  </Build>
  <Build Id="81">
    <BodyId>127</BodyId>
    <LensId>192</LensId>
    <FilterId>711</FilterId>
    <Price>686</Price>
    <Year>2009-07-06</Year>
  </Build>
  <Build Id="82">
    <BodyId>183</BodyId>
    <LensId>400</LensId>
    <FilterId>774</FilterId>
    <Price>911</Price>
    <Year>2015-01-05</Year>
  </Build>
  <Build Id="83">
    <BodyId>959</BodyId>
    <LensId>836</LensId>
    <FilterId>831</FilterId>
    <Price>1024</Price>
    <Year>2008-01-05</Year>
  </Build>
  <Build Id="84">
    <BodyId>629</BodyId>
    <LensId>429</LensId>
    <FilterId>734</FilterId>
    <Price>824</Price>
    <Year>2015-10-04</Year>
  </Build>
  <Build Id="85">
    <BodyId>504</BodyId>
    <LensId>679</LensId>
    <FilterId>870</FilterId>
    <Price>676</Price>
    <Year>2009-11-02</Year>
  </Build>
  <Build Id="86">
    <BodyId>215</BodyId>
    <LensId>487</LensId>
    <FilterId>536</FilterId>
    <Price>749</Price>
    <Year>2013-08-24</Year>
  </Build>
  <Build Id="87">
    <BodyId>390</BodyId>
    <LensId>546</LensId>
    <FilterId>975</FilterId>
    <Price>1239</Price>
    <Year>2010-04-27</Year>
  </Build>
  <Build Id="88">
    <BodyId>952</BodyId>
    <LensId>309</LensId>
    <FilterId>860</FilterId>
    <Price>1096</Price>
    <Year>2012-09-29</Year>
  </Build>
  <Build Id="89">
    <BodyId>94</BodyId>
    <LensId>455</LensId>
    <FilterId>929</FilterId>
    <Price>618</Price>
    <Year>2012-10-16</Year>
  </Build>
  <Build Id="90">
    <BodyId>880</BodyId>
    <LensId>949</LensId>
    <FilterId>170</FilterId>
    <Price>1323</Price>
    <Year>2009-06-24</Year>
  </Build>
  <Build Id="91">
    <BodyId>479</BodyId>
    <LensId>527</LensId>
    <FilterId>165</FilterId>
    <Price>1360</Price>
    <Year>2013-11-04</Year>
  </Build>
  <Build Id="92">
    <BodyId>359</BodyId>
    <LensId>228</LensId>
    <FilterId>417</FilterId>
    <Price>734</Price>
    <Year>2017-07-22</Year>
  </Build>
  <Build Id="93">
    <BodyId>684</BodyId>
    <LensId>937</LensId>
    <FilterId>847</FilterId>
    <Price>581</Price>
    <Year>2009-09-11</Year>
  </Build>
  <Build Id="94">
    <BodyId>711</BodyId>
    <LensId>321</LensId>
    <FilterId>225</FilterId>
    <Price>1314</Price>
    <Year>2008-12-29</Year>
  </Build>
  <Build Id="95">
    <BodyId>376</BodyId>
    <LensId>454</LensId>
    <FilterId>331</FilterId>
    <Price>364</Price>
    <Year>2018-06-26</Year>
  </Build>
  <Build Id="96">
    <BodyId>495</BodyId>
    <LensId>143</LensId>
    <FilterId>84</FilterId>
    <Price>714</Price>
    <Year>2013-02-15</Year>
  </Build>
  <Build Id="97">
    <BodyId>939</BodyId>
    <LensId>208</LensId>
    <FilterId>554</FilterId>
    <Price>659</Price>
    <Year>2008-07-06</Year>
  </Build>
  <Build Id="98">
    <BodyId>871</BodyId>
    <LensId>650</LensId>
    <FilterId>480</FilterId>
    <Price>1358</Price>
    <Year>2017-09-04</Year>
  </Build>
  <Build Id="99">
    <BodyId>458</BodyId>
    <LensId>855</LensId>
    <FilterId>834</FilterId>
    <Price>923</Price>
    <Year>2011-03-17</Year>
  </Build>
  <Build Id="100">
    <BodyId>425</BodyId>
    <LensId>921</LensId>
    <FilterId>553</FilterId>
    <Price>614</Price>
    <Year>2010-06-02</Year>
  </Build>
  <Build Id="101">
    <BodyId>374</BodyId>
    <LensId>339</LensId>
    <FilterId>985</FilterId>
    <Price>861</Price>
    <Year>2009-08-11</Year>
  </Build>
  <Build Id="102">
    <BodyId>625</BodyId>
    <LensId>544</LensId>
    <FilterId>343</FilterId>
    <Price>1406</Price>
    <Year>2008-12-13</Year>
  </Build>
  <Build Id="103">
    <BodyId>484</BodyId>
    <LensId>170</LensId>
    <FilterId>893</FilterId>
    <Price>961</Price>
    <Year>2015-08-28</Year>
  </Build>
  <Build Id="104">
    <BodyId>507</BodyId>
    <LensId>511</LensId>
    <FilterId>994</FilterId>
    <Price>1388</Price>
    <Year>2008-04-15</Year>
  </Build>
  <Build Id="105">
    <BodyId>19</BodyId>
    <LensId>920</LensId>
    <FilterId>537</FilterId>
    <Price>1139</Price>
    <Year>2015-06-08</Year>
  </Build>
  <Build Id="106">
    <BodyId>709</BodyId>
    <LensId>59</LensId>
    <FilterId>413</FilterId>
    <Price>870</Price>
    <Year>2017-09-05</Year>
  </Build>
  <Build Id="107">
    <BodyId>710</BodyId>
    <LensId>708</LensId>
    <FilterId>75</FilterId>
    <Price>883</Price>
    <Year>2010-03-25</Year>
  </Build>
  <Build Id="108">
    <BodyId>432</BodyId>
    <LensId>536</LensId>
    <FilterId>783</FilterId>
    <Price>484</Price>
    <Year>2017-12-05</Year>
  </Build>
  <Build Id="109">
    <BodyId>638</BodyId>
    <LensId>407</LensId>
    <FilterId>805</FilterId>
    <Price>943</Price>
    <Year>2017-06-10</Year>
  </Build>
  <Build Id="110">
    <BodyId>681</BodyId>
    <LensId>768</LensId>
    <FilterId>945</FilterId>
    <Price>612</Price>
    <Year>2009-07-14</Year>
  </Build>
  <Build Id="111">
    <BodyId>543</BodyId>
    <LensId>531</LensId>
    <FilterId>762</FilterId>
    <Price>824</Price>
    <Year>2017-12-13</Year>
  </Build>
  <Build Id="112">
    <BodyId>32</BodyId>
    <LensId>343</LensId>
    <FilterId>219</FilterId>
    <Price>1202</Price>
    <Year>2014-07-31</Year>
  </Build>
  <Build Id="113">
    <BodyId>582</BodyId>
    <LensId>158</LensId>
    <FilterId>628</FilterId>
    <Price>1387</Price>
    <Year>2009-08-31</Year>
  </Build>
  <Build Id="114">
    <BodyId>610</BodyId>
    <LensId>981</LensId>
    <FilterId>27</FilterId>
    <Price>783</Price>
    <Year>2011-07-22</Year>
  </Build>
  <Build Id="115">
    <BodyId>109</BodyId>
    <LensId>51</LensId>
    <FilterId>198</FilterId>
    <Price>1017</Price>
    <Year>2010-05-12</Year>
  </Build>
  <Build Id="116">
    <BodyId>220</BodyId>
    <LensId>449</LensId>
    <FilterId>992</FilterId>
    <Price>1303</Price>
    <Year>2018-05-24</Year>
  </Build>
  <Build Id="117">
    <BodyId>892</BodyId>
    <LensId>647</LensId>
    <FilterId>76</FilterId>
    <Price>1300</Price>
    <Year>2018-05-08</Year>
  </Build>
  <Build Id="118">
    <BodyId>817</BodyId>
    <LensId>716</LensId>
    <FilterId>229</FilterId>
    <Price>438</Price>
    <Year>2016-04-10</Year>
  </Build>
  <Build Id="119">
    <BodyId>555</BodyId>
    <LensId>225</LensId>
    <FilterId>940</FilterId>
    <Price>813</Price>
    <Year>2015-08-18</Year>
  </Build>
  <Build Id="120">
    <BodyId>148</BodyId>
    <LensId>868</LensId>
    <FilterId>567</FilterId>
    <Price>922</Price>
    <Year>2010-06-24</Year>
  </Build>
  <Build Id="121">
    <BodyId>91</BodyId>
    <LensId>84</LensId>
    <FilterId>185</FilterId>
    <Price>1238</Price>
    <Year>2017-01-04</Year>
  </Build>
  <Build Id="122">
    <BodyId>857</BodyId>
    <LensId>14</LensId>
    <FilterId>414</FilterId>
    <Price>1370</Price>
    <Year>2012-06-09</Year>
  </Build>
  <Build Id="123">
    <BodyId>797</BodyId>
    <LensId>64</LensId>
    <FilterId>459</FilterId>
    <Price>1129</Price>
    <Year>2013-05-15</Year>
  </Build>
  <Build Id="124">
    <BodyId>911</BodyId>
    <LensId>3</LensId>
    <FilterId>397</FilterId>
    <Price>485</Price>
    <Year>2013-11-29</Year>
  </Build>
  <Build Id="125">
    <BodyId>279</BodyId>
    <LensId>188</LensId>
    <FilterId>432</FilterId>
    <Price>719</Price>
    <Year>2010-12-29</Year>
  </Build>
  <Build Id="126">
    <BodyId>458</BodyId>
    <LensId>676</LensId>
    <FilterId>340</FilterId>
    <Price>501</Price>
    <Year>2017-01-24</Year>
  </Build>
  <Build Id="127">
    <BodyId>718</BodyId>
    <LensId>743</LensId>
    <FilterId>332</FilterId>
    <Price>1301</Price>
    <Year>2016-05-26</Year>
  </Build>
  <Build Id="128">
    <BodyId>350</BodyId>
    <LensId>192</LensId>
    <FilterId>790</FilterId>
    <Price>1094</Price>
    <Year>2016-03-21</Year>
  </Build>
  <Build Id="129">
    <BodyId>635</BodyId>
    <LensId>219</LensId>
    <FilterId>771</FilterId>
    <Price>732</Price>
    <Year>2013-07-19</Year>
  </Build>
  <Build Id="130">
    <BodyId>627</BodyId>
    <LensId>708</LensId>
    <FilterId>605</FilterId>
    <Price>429</Price>
    <Year>2011-07-02</Year>
  </Build>
  <Build Id="131">
    <BodyId>197</BodyId>
    <LensId>216</LensId>
    <FilterId>814</FilterId>
    <Price>1343</Price>
    <Year>2008-11-04</Year>
  </Build>
  <Build Id="132">
    <BodyId>595</BodyId>
    <LensId>914</LensId>
    <FilterId>467</FilterId>
    <Price>536</Price>
    <Year>2015-12-25</Year>
  </Build>
  <Build Id="133">
    <BodyId>809</BodyId>
    <LensId>772</LensId>
    <FilterId>452</FilterId>
    <Price>1375</Price>
    <Year>2010-06-29</Year>
  </Build>
  <Build Id="134">
    <BodyId>254</BodyId>
    <LensId>158</LensId>
    <FilterId>101</FilterId>
    <Price>977</Price>
    <Year>2018-07-14</Year>
  </Build>
  <Build Id="135">
    <BodyId>605</BodyId>
    <LensId>556</LensId>
    <FilterId>197</FilterId>
    <Price>1119</Price>
    <Year>2009-03-22</Year>
  </Build>
  <Build Id="136">
    <BodyId>356</BodyId>
    <LensId>623</LensId>
    <FilterId>876</FilterId>
    <Price>1180</Price>
    <Year>2015-07-05</Year>
  </Build>
  <Build Id="137">
    <BodyId>744</BodyId>
    <LensId>125</LensId>
    <FilterId>475</FilterId>
    <Price>692</Price>
    <Year>2014-10-25</Year>
  </Build>
  <Build Id="138">
    <BodyId>706</BodyId>
    <LensId>807</LensId>
    <FilterId>684</FilterId>
    <Price>983</Price>
    <Year>2009-05-02</Year>
  </Build>
  <Build Id="139">
    <BodyId>714</BodyId>
    <LensId>241</LensId>
    <FilterId>818</FilterId>
    <Price>817</Price>
    <Year>2015-05-07</Year>
  </Build>
  <Build Id="140">
    <BodyId>49</BodyId>
    <LensId>140</LensId>
    <FilterId>233</FilterId>
    <Price>1113</Price>
    <Year>2018-03-18</Year>
  </Build>
  <Build Id="141">
    <BodyId>502</BodyId>
    <LensId>42</LensId>
    <FilterId>524</FilterId>
    <Price>1253</Price>
    <Year>2009-08-26</Year>
  </Build>
  <Build Id="142">
    <BodyId>896</BodyId>
    <LensId>344</LensId>
    <FilterId>1</FilterId>
    <Price>708</Price>
    <Year>2011-09-21</Year>
  </Build>
  <Build Id="143">
    <BodyId>504</BodyId>
    <LensId>188</LensId>
    <FilterId>532</FilterId>
    <Price>861</Price>
    <Year>2008-06-03</Year>
  </Build>
  <Build Id="144">
    <BodyId>948</BodyId>
    <LensId>461</LensId>
    <FilterId>881</FilterId>
    <Price>627</Price>
    <Year>2014-07-03</Year>
  </Build>
  <Build Id="145">
    <BodyId>634</BodyId>
    <LensId>460</LensId>
    <FilterId>482</FilterId>
    <Price>1331</Price>
    <Year>2013-04-26</Year>
  </Build>
  <Build Id="146">
    <BodyId>55</BodyId>
    <LensId>495</LensId>
    <FilterId>811</FilterId>
    <Price>432</Price>
    <Year>2015-04-23</Year>
  </Build>
  <Build Id="147">
    <BodyId>608</BodyId>
    <LensId>41</LensId>
    <FilterId>541</FilterId>
    <Price>1231</Price>
    <Year>2010-07-11</Year>
  </Build>
  <Build Id="148">
    <BodyId>467</BodyId>
    <LensId>900</LensId>
    <FilterId>986</FilterId>
    <Price>455</Price>
    <Year>2015-04-13</Year>
  </Build>
  <Build Id="149">
    <BodyId>800</BodyId>
    <LensId>336</LensId>
    <FilterId>364</FilterId>
    <Price>828</Price>
    <Year>2017-04-05</Year>
  </Build>
  <Build Id="150">
    <BodyId>244</BodyId>
    <LensId>53</LensId>
    <FilterId>712</FilterId>
    <Price>1244</Price>
    <Year>2013-11-10</Year>
  </Build>
  <Build Id="151">
    <BodyId>167</BodyId>
    <LensId>481</LensId>
    <FilterId>54</FilterId>
    <Price>1223</Price>
    <Year>2014-06-21</Year>
  </Build>
  <Build Id="152">
    <BodyId>522</BodyId>
    <LensId>501</LensId>
    <FilterId>279</FilterId>
    <Price>1199</Price>
    <Year>2017-07-12</Year>
  </Build>
  <Build Id="153">
    <BodyId>585</BodyId>
    <LensId>829</LensId>
    <FilterId>500</FilterId>
    <Price>1157</Price>
    <Year>2017-09-01</Year>
  </Build>
  <Build Id="154">
    <BodyId>433</BodyId>
    <LensId>19</LensId>
    <FilterId>440</FilterId>
    <Price>603</Price>
    <Year>2012-02-27</Year>
  </Build>
  <Build Id="155">
    <BodyId>789</BodyId>
    <LensId>452</LensId>
    <FilterId>646</FilterId>
    <Price>1039</Price>
    <Year>2016-11-24</Year>
  </Build>
  <Build Id="156">
    <BodyId>665</BodyId>
    <LensId>427</LensId>
    <FilterId>226</FilterId>
    <Price>1095</Price>
    <Year>2012-12-21</Year>
  </Build>
  <Build Id="157">
    <BodyId>854</BodyId>
    <LensId>497</LensId>
    <FilterId>646</FilterId>
    <Price>945</Price>
    <Year>2015-09-09</Year>
  </Build>
  <Build Id="158">
    <BodyId>506</BodyId>
    <LensId>432</LensId>
    <FilterId>284</FilterId>
    <Price>1006</Price>
    <Year>2017-11-08</Year>
  </Build>
  <Build Id="159">
    <BodyId>966</BodyId>
    <LensId>742</LensId>
    <FilterId>837</FilterId>
    <Price>1346</Price>
    <Year>2010-06-06</Year>
  </Build>
  <Build Id="160">
    <BodyId>841</BodyId>
    <LensId>19</LensId>
    <FilterId>601</FilterId>
    <Price>1127</Price>
    <Year>2010-06-16</Year>
  </Build>
  <Build Id="161">
    <BodyId>902</BodyId>
    <LensId>965</LensId>
    <FilterId>223</FilterId>
    <Price>482</Price>
    <Year>2018-07-22</Year>
  </Build>
  <Build Id="162">
    <BodyId>545</BodyId>
    <LensId>578</LensId>
    <FilterId>403</FilterId>
    <Price>1199</Price>
    <Year>2018-08-24</Year>
  </Build>
  <Build Id="163">
    <BodyId>566</BodyId>
    <LensId>975</LensId>
    <FilterId>852</FilterId>
    <Price>850</Price>
    <Year>2016-09-25</Year>
  </Build>
  <Build Id="164">
    <BodyId>476</BodyId>
    <LensId>871</LensId>
    <FilterId>420</FilterId>
    <Price>1040</Price>
    <Year>2011-03-16</Year>
  </Build>
  <Build Id="165">
    <BodyId>923</BodyId>
    <LensId>881</LensId>
    <FilterId>236</FilterId>
    <Price>1035</Price>
    <Year>2015-10-31</Year>
  </Build>
  <Build Id="166">
    <BodyId>436</BodyId>
    <LensId>900</LensId>
    <FilterId>297</FilterId>
    <Price>1286</Price>
    <Year>2008-09-23</Year>
  </Build>
  <Build Id="167">
    <BodyId>126</BodyId>
    <LensId>388</LensId>
    <FilterId>95</FilterId>
    <Price>1005</Price>
    <Year>2018-04-17</Year>
  </Build>
  <Build Id="168">
    <BodyId>349</BodyId>
    <LensId>51</LensId>
    <FilterId>386</FilterId>
    <Price>458</Price>
    <Year>2014-07-17</Year>
  </Build>
  <Build Id="169">
    <BodyId>264</BodyId>
    <LensId>907</LensId>
    <FilterId>383</FilterId>
    <Price>1139</Price>
    <Year>2013-10-06</Year>
  </Build>
  <Build Id="170">
    <BodyId>20</BodyId>
    <LensId>636</LensId>
    <FilterId>333</FilterId>
    <Price>962</Price>
    <Year>2009-03-19</Year>
  </Build>
  <Build Id="171">
    <BodyId>627</BodyId>
    <LensId>790</LensId>
    <FilterId>759</FilterId>
    <Price>458</Price>
    <Year>2010-12-17</Year>
  </Build>
  <Build Id="172">
    <BodyId>12</BodyId>
    <LensId>773</LensId>
    <FilterId>828</FilterId>
    <Price>489</Price>
    <Year>2016-01-16</Year>
  </Build>
  <Build Id="173">
    <BodyId>850</BodyId>
    <LensId>112</LensId>
    <FilterId>924</FilterId>
    <Price>1143</Price>
    <Year>2016-09-07</Year>
  </Build>
  <Build Id="174">
    <BodyId>750</BodyId>
    <LensId>927</LensId>
    <FilterId>89</FilterId>
    <Price>1356</Price>
    <Year>2013-08-04</Year>
  </Build>
  <Build Id="175">
    <BodyId>342</BodyId>
    <LensId>798</LensId>
    <FilterId>857</FilterId>
    <Price>1252</Price>
    <Year>2017-06-08</Year>
  </Build>
  <Build Id="176">
    <BodyId>174</BodyId>
    <LensId>992</LensId>
    <FilterId>576</FilterId>
    <Price>466</Price>
    <Year>2008-11-05</Year>
  </Build>
  <Build Id="177">
    <BodyId>388</BodyId>
    <LensId>590</LensId>
    <FilterId>918</FilterId>
    <Price>1003</Price>
    <Year>2008-05-09</Year>
  </Build>
  <Build Id="178">
    <BodyId>340</BodyId>
    <LensId>634</LensId>
    <FilterId>987</FilterId>
    <Price>1352</Price>
    <Year>2017-06-15</Year>
  </Build>
  <Build Id="179">
    <BodyId>460</BodyId>
    <LensId>208</LensId>
    <FilterId>916</FilterId>
    <Price>438</Price>
    <Year>2008-04-18</Year>
  </Build>
  <Build Id="180">
    <BodyId>725</BodyId>
    <LensId>2</LensId>
    <FilterId>278</FilterId>
    <Price>766</Price>
    <Year>2017-10-28</Year>
  </Build>
  <Build Id="181">
    <BodyId>943</BodyId>
    <LensId>298</LensId>
    <FilterId>806</FilterId>
    <Price>1138</Price>
    <Year>2013-05-22</Year>
  </Build>
  <Build Id="182">
    <BodyId>209</BodyId>
    <LensId>184</LensId>
    <FilterId>829</FilterId>
    <Price>910</Price>
    <Year>2012-08-04</Year>
  </Build>
  <Build Id="183">
    <BodyId>501</BodyId>
    <LensId>566</LensId>
    <FilterId>746</FilterId>
    <Price>951</Price>
    <Year>2010-05-19</Year>
  </Build>
  <Build Id="184">
    <BodyId>296</BodyId>
    <LensId>217</LensId>
    <FilterId>151</FilterId>
    <Price>617</Price>
    <Year>2012-02-17</Year>
  </Build>
  <Build Id="185">
    <BodyId>905</BodyId>
    <LensId>72</LensId>
    <FilterId>125</FilterId>
    <Price>1051</Price>
    <Year>2015-02-06</Year>
  </Build>
  <Build Id="186">
    <BodyId>894</BodyId>